date;hashtag;tweet;username;intent;emotion
22/05/2020 04:20;['#nawakngalam', '#kpm', '#bansos', '#kelurahanbandulan', '#pemkotmalang'];pemkot malang melalui kelurahan bandulan menyalurkan bantuan sosial tunai bst pemprov jatim kepada keluarga penerima manfaat kpm nawakngalam kpm bansos kelurahanbandulan pemkotmalang pictwittercomlrattprg0a;kelurahan bandulan;positive;love
22/05/2020 04:17;['#indonesiaterserah'];pbidi tirtahudhi perjuangan dokter selama ini akan sia sia masyarakat indonesia akan tetap tidak menaati peratutan psbbsocial distancing dll sampai pbidi membuat pernyataan tidak akan menangani kasus covid19 jika masyarakat tetap menghiraukan peraturanindonesiaterserah;pembasmi kegoblokan;negative;sad
22/05/2020 04:14;['#indonesiaterserah'];merasa percuma berjuang lebaran sendirian di kota orang dan adikku yg menahan hasrat pengen pulangindonesiaterserah;lukita;negative;sad
22/05/2020 04:13;['#indonesiaterserah', '#sakkarepmu', '#bodoamat'];siapapun kalian yang nekat mudik dari jabodetabek ke kampung besok abis lebaran please ga usah balik ke jabodetabekdi kampung terus aja disini ga butuh orangorang egois kaya kalianindonesiaterserah sakkarepmu bodoamat;hussein;negative;fear
22/05/2020 04:12;['#indonesiaterserah'];indonesiaterserah uwis kesel ngeyel ndablek ;iksan solo;negative;anger
22/05/2020 04:11;['#indonesiaterserah'];gak ada takut nye si ibuindonesiaterserah pictwittercomyukruvtsdz;dewanto l wicaksono;negative;fear
22/05/2020 04:10;['#covid2019', '#dbsn', '#demambatuksesaknapas', '#bangkitkandayatangkal', '#kokohkanantibodi', '#berdayakanimunitastubuh', '#isolasi', '#psbb', '#indonesiajanganterserah', '#indonesiabangkit', '#indonesiaterserah'];bebas beban covid2019 masyarakat perlu waspada tanpa cemas bersiap hadapi gejala dbsn demambatuksesaknapas bangkitkandayatangkal kokohkanantibodi berdayakanimunitastubuh dgn gizi seimbang tanpa isolasi psbbindonesiajanganterserah indonesiabangkit indonesiaterserah pictwittercompkexkjies0;arnold mamesah ma;positive;
22/05/2020 04:08;['#indonesiaterserah', '#indonesiaterserah'];cocot si dungu bilang curva harus turun dengan cepat bagaimanapun cara tapicocot si dungu tdk bisa tepat dengan apa yg die katakancocot si dungu sllu mincla mincle sekarang siapa yg percaya sama cocot si dungu indonesiaterserahindonesiaterserah;jngres14;negative;anger
22/05/2020 04:03;['#indonesiaterserah'];asyiqqq deket rumah aku lagi pada berbondong bondong nih beli baju baru tuk di pakai di alam barzah indonesiaterserah pictwittercomhxb0sbibux;ku menangis;negative;anger
22/05/2020 04:00;['#indonesiaterserah', '#psbbkedodoran', '#pasarpagisamarinda'];antara ibunya immune atau kudungnya negative covid indonesiaterserah psbbkedodoran pasarpagisamarinda pictwittercom1svwqia3kn;kenes kukis;negative;anger
22/05/2020 04:00;['#indonesiaterserah'];ricuh pembagian bansos di bandungapakabar psbb apakabar social distancing apakabar physical distancing mungkinkah peraturan yg tegas bisa diterapkan dalam hal seperti ini indonesiaterserah pictwittercombqzxewbqzv;musisi tepar;negative;sad
22/05/2020 03:57;['#indonesiaterserah'];awas aja ntar kalo vaksin udah ada dan awalnya terbatas distribusinya di indonesia trs yg didahulukan pasti kelompok yg yang ituitu aja trus ntr ada aja yg jual ilegal dgn harga selangit entah aslipalsu tuh vaksinnya indonesiaterserah;luqman hakim;negative;anger
22/05/2020 03:52;['#indonesiaterserah'];indonesiaterserah saat ini rakyat indonesia terancam nyawanya akibat kegagalan pemerintah menangani krisis pandemi covid 19 pictwittercomwpfhxo4wru;raisa tjokrodinata;negative;fear
22/05/2020 03:51;['#indonesiaterserah'];45thn ke bwh diimbau blh kerja diprotesrestoran cpt saji ditutup berani kumpulh3 toko baju malah rame sampe berjubelpetugas ksh tahu bener2 malah diajak ributbagi2 bantuan malah ributini ramadhan woiindonesiaterserah ;bayu prasetyo;negative;anger
22/05/2020 03:50;['#indonesiaterserah'];udah mah gaji aman kalo sakit fasilitas kesehatan terjamin ga ada tandatanda kena phk tapi kerjanya ga beres di indonesia yg kek gitu bukan cuma ada tapi banyak indonesiaterserah;luqman hakim;negative;anger
22/05/2020 03:50;['#indonesiaterserah', '#terserahindonesia', '#welcomeherdimmunity'];kalian tdk mau di atur kalian tdk peduli dgn nyawa sendiri dan orang2 terdekat kalian ya sudah terserah kalian kami sudah lelah biar seleksi alam yang bekerja sekarang indonesiaterserah terserahindonesia welcomeherdimmunity pictwittercom3n1tzm7exy;dequalizernewnormalpulihkanekonomi;negative;fear
22/05/2020 03:47;['#indonesiaterserah'];anda cuma bosan dirumah tp sebagian besar orang lebih bosan lagi tiap hari bertaruh nyawa demi nafkah keluarganya dan demi orang lainstop menjadi bodoh berempati lah sedikitindonesiaterserah;sylvernes oktaviason;negative;anger
22/05/2020 03:47;['#tiktok', '#indonesiaterserah'];lihat video abah kenz tiktok mohon seperti ini sedih dan miris lihatnya udah ah jangan di gede gede in berita nya corona kami warga biasa juga takut lambeturahtweet krmtroysuryo2 najwashihab jokowi indonesiaterserah;boleh berteman;negative;sad
22/05/2020 03:46;['#indonesiaterserah'];bener2 indonesiaterserah dah pictwittercombpce3kyrsc; gurl;negative;anger
22/05/2020 03:46;['#berita', '#nusabali', '#bansos', '#danhibah', '#dprdbali'];dewan desak cair dana hibah dan bansos berita nusabali bansos danhibah dprdbali;nusabalicom;negative;
22/05/2020 03:46;['#indonesiaterserah'];anda cape dirumah aja adik saya adlh seorang petugas laboratorium rmh sakit adlh dan dia kepala keluarga anaknya 2 dia lbh cape lg tiap hr berkutat dgn resiko tertular krn bs tiap hr berkutat dgn sample pasien trmasuk pdp dan opdindonesiaterserah;sylvernes oktaviason;negative;sad
22/05/2020 03:46;['#presidenstandupcomedy', '#indonesiaterserah', '#bonekasial'];presidenstandupcomedy apa yg dipercaya dari diaindonesiaterserahbonekasial ;spark san;negative;anger
22/05/2020 03:44;['#indonesiaterserah', '#indonesiajanganterserah'];doan adalah bentuk kepedulian kita mari ubah indonesiaterserah menjadi indonesiajanganterserah kita kuat karena persatuan bukan satuan pictwittercomutaln2vl4l;ruang rasa;positive;love
22/05/2020 03:43;['#indonesiaterserah'];bahkan sebagian ahli juga berpendapat kita bisa saja seumur hidup berdampingan dengan coro a seperti saat ini influenza msh eksis contoh lain coba bayangin kalo paracetamol blm ketemu tiap kena pusing kepala pasti susah sembuhnyaindonesiaterserah;sylvernes oktaviason;negative;fear
22/05/2020 03:41;['#indonesiaterserah'];corona gak akan selesai sampe ada vaksinnya dan banyak ahli menduga vaksinnya memang tidak di release dalam waktu dekat sebelum usa election day artinya masa pandemi ini msh akan sangat panjangindonesiaterserah;sylvernes oktaviason;negative;sad
22/05/2020 03:40;['#mudiktetapdilarang', '#nomudik', '#indonesian', '#indonesiaterserah', '#indonesiaojosakkarepmu'];orang indonesiadilarang mudik malah nekat mudik alasan sdh gk ada pekerjaan gk ada penghasilan also orang indonesiapusat perbelanjaan dibuka serrbuuumudiktetapdilarangnomudik indonesianindonesiaterserahindonesiaojosakkarepmu pictwittercomcbjpt5hlkd;pungkas ap;negative;anger
22/05/2020 03:39;['#indonesiaterserah'];sebagian orang lbh takut gak bs beli baju baru buat lebaran ketimbang takut resiko ketular corona bedesak ketika distro dan mall dibuka seketika gak perduli psbbindonesiaterserah;sylvernes oktaviason;negative;sad
22/05/2020 03:34;['#indonesiaterserah'];psbb diperpanjangpsbbbbbbbbbbbbbbbbbbbbbpembatasan sosial berskala besar belum berakhir bisa bisa berlanjut bulan berikutnya bahkan bisa berkepanjangan bila banyak budak bedegong bertebaran belanja buat baju berlebaran indonesiaterserah infobdg bandungfess;harfudin;negative;fear
22/05/2020 03:32;['#indonesiaterserah'];tidak ada yang mahal kecuali hanya kesehatan yang mahalsegala apapun bisa ditunda namun kesehatan tidak dapat ditundaindonesiaterserah;haloalda;positive;
22/05/2020 03:30;['#indonesiaterserah'];21 mei jawa timur rekor tertinggiindonesiaterserah;agus kila;negative;sad
22/05/2020 03:29;['#indonesiaterserah'];kemarin ke supermarket beli kebutuhan yg emg bener2 kudu dibelimau keluar rumah udah kek ninja ajaeeehh pas nglewatin toko emas liat emak2 pada umpel2anhahahihihoho no masker no social distancing club hati ini langsung kretek rasanya indonesiaterserah;d i l l a;negative;sad
22/05/2020 03:28;['#indonesiaterserah'];gada takut takutnya warga 62 mah indonesiaterserah;kayy;negative;anger
22/05/2020 03:27;['#indonesiaterserah'];mungkin konsep the new normal adalah herd immunityindonesiaterserah;bije dwi xiao putra;negative;anger
22/05/2020 03:27;['#indonesiaterserah'];serem ga si aturan dalam ranah pribadidalam mobil misal di perketat kendaraan di cek satu2 padahal notabene org yg semobil dimasa kaya gini juga serumah ini dirumah senggol2an tapi aturan di tempat umum di longgarin logikanya dimanaindonesiaterserah;t i t a;negative;anger
22/05/2020 03:27;['#jumatberkah', '#presidenstandupcomedy', '#rezimberjutakasus', '#indonesiaterserah'];jujur itu memang berat karena kejujuran bisa membuat byk orang gak suka kejujuran membuat hati tenangkejujuran akan menyelamatkan kita di dunia jg di akhiratjumatberkahpresidenstandupcomedyrezimberjutakasusindonesiaterserah ;bcaralahapaadany ;positive;love
22/05/2020 03:25;['#indonesiaterserah'];lawong ndableg kabeh ini belum seberapa tunggu 12mg setelah lebaran ambyaaarr indonesiaterserah;arief b;negative;anger
22/05/2020 03:25;['#indonesiaterserah', '#psbbbelumdilonggarkan', '#covid__19', '#berdamaidgncorona', '#stayathome', '#bersatulawancovid19'];jadi ini kejadiannya didaerah ku di daerahku masih normal seperti tdk ada covid 19 cuma pakai masker dan cuci tanganindonesiaterserah psbbbelumdilonggarkancovid19 berdamaidgncorona stayathome bersatulawancovid19 pictwittercomnd4vsxiaji;machiatto;negative;sad
22/05/2020 03:23;['#indonesiaterserah'];indonesiaterserah y udh;daraa;negative;anger
22/05/2020 03:23;['#stayinside', '#indonesiamelawancovid19', '#indonesiaterserah'];stayinside teman teman mau ikut indonesiamelawancovid19 atau indonesiaterserah yaa pilihan kalian ;an;negative;sad
22/05/2020 03:22;['#indonesiaterserah'];indonesiaterserah yahhh melihat perkembangan kemarin kayanya masih blm jelas 1000 orang lebih kan bener nih grafik kayanya pictwittercomeqemfwgk3l;seputar kota tegal;negative;fear
22/05/2020 03:22;['#indonesiaterserah'];pemerintah minta maaf akui sulit membuat kebijakan untuk rakyat kayanya lebih tepat ya kalo begini indonesiaterserah;obama;negative;fear
22/05/2020 03:22;['#indonesiaterserah'];apalah daya psbb hanyalah sebuah singkatan indonesiaterserah;istrinya pak camat;negative;sad
22/05/2020 03:22;['#indonesiaterserah'];selamat pagi indonesia selamat pagi yg lagi siap2 berdesakan di mall pasar swalayan pasar tradisional keramaian yg lain indonesiaterserah;curup online;negative;anger
22/05/2020 03:20;['#indonesiaterserah'];tagar indonesiaterserah gambaran kinerja pemerintah antara ada dan tiada ;mr loemy;negative;sad
22/05/2020 03:17;['#indonesiaterserah'];males tinggal di endonezia don wkwkindonesiaterserah;gichell;negative;anger
22/05/2020 03:10;['#indonesiaterserah', '#terserahindonesia'];g heran kl d indo d cap penanganan covidny paling buruk di asiatenggara presiden ngeluarin kebijaka bskny dia batalin lg presiden ngasi statemen bskny pembantuny ngebantah blm lg antar pembantu beda omongan beda kebijakan indonesiaterserahterserahindonesia;ru;negative;anger
22/05/2020 03:06;['#indonesiaterserah', '#sakarepmu'];kerumunan padat merayap pagi ini di pasar tradisional istilahnya prepegan lupa covid 19 lupa jaga jarak indonesiaterserah sakarepmu;arif;negative;fear
22/05/2020 03:06;['#indonesiaterserah'];hoho indonesia karepmu indonesiaterserah pictwittercomul7scs0n2j;juliett;negative;anger
22/05/2020 03:02;['#indonesiaterserah', '#terserahindonesia'];kalo masih kayak giniindonesiaterserahterserahindonesia ;zo taeoh;negative;anger
22/05/2020 03:02;['#covid19ke', '#indonesiaterserah'];hayo gimana mau belajar dari sejarah atau mau mengulang sejarahcovid19ke indonesiaterserah pictwittercomqqwzhefyrk;nggak;negative;fear
22/05/2020 02:59;['#tebet', '#indonesiaterserah'];katanya rame eh pas gua cek gak ada apa apatebetindonesiaterserah pictwittercomzgluli7oj3;naufal;negative;
22/05/2020 02:57;['#indonesiaterserah', '#indonesiajanganlengah'];teruslah berbuat untuk kebaikan abaikan indonesiaterserah tetaplah waspada aku paham dirimu bosan dengan situasi ini tapi bertahanlah jadikan indonesiajanganlengah jangan lengah dan lelah jagoanku tetaplah membuatku kagum dengan apa yg ada saat inisptganam36 pictwittercomjm8cku8zkb;the cocot can blank;positive;love
22/05/2020 02:55;['#indonesiaterserah'];but yeah klakuan aparat yg tajam kebawah tp tumpul keatas kek gini emg sangat layak bwt dipertanyakanklo diambil cunto laen ini sm kek kasus yg di bogorsenior walkot yg sm marahnyapnanganan yg di bogor omong btwgmn yah damai apa diproses nihindonesiaterserah;providensia;negative;anger
22/05/2020 02:55;['#indonesiaterserah'];sahur sampe dibangunin saking ngantuknyaabis makan ngerokokkopi baru di buatinrokok belum habis udah ketiduranbangun tidur tiba tiba pengen bilang sayang rokok sama kopinya indonesiaterserah pictwittercomf7y6xfhcvl;mas yazed;negative;sad
22/05/2020 02:47;['#indonesiaterserah'];wah gue kagum bgt sama ketololan warga indonesia wkwkwk wow indonesiaterserah pictwittercomw4fnkid0mz;apa aja boleh;negative;anger
22/05/2020 02:46;['#patuhiprotokolcovid19', '#indonesiaterserah', '#jumatberkah'];pesan damai taggar twitter patuhiprotokolcovid19 dan indonesiaterserah lewat youtubejumatberkah;revolusi ilmiah;positive;love
22/05/2020 02:43;['#indonesiaterserah'];selamat datang gelombang kedua siap2 maut menanti anda indonesiaterserah pictwittercomvdz0nyabcy;fila;negative;fear
22/05/2020 02:41;['#indonesiaterserah'];kehabisan kata2 indonesiaterserah ;wizzi;negative;sad
22/05/2020 02:40;['#indonesiaterserah'];indonesiaterserah gundulmu deloken iki matamu cuk opo ancen wes gak duwe ati ;eki;negative;anger
22/05/2020 02:40;['#indonesiaterserah', '#coronavirus', '#maritempelengcorona'];yaudah lah gak tau lagi harus ngapain di home indonesiaterserah coronavirus maritempelengcorona pictwittercomglvywi6hwj;olivaja;negative;sad
22/05/2020 02:35;['#indonesiaterserah'];semoga wfh 2 bulan lbh ga sia2 indonesiaterserah ;wizzi;negative;sad
22/05/2020 02:31;['#indonesiaterserah'];indonesiaterserahmasyarakat lakukan mau mu sesuka hati mu namun jangan menangis jika nanti kena covid19;domingo;negative;anger
22/05/2020 02:29;['#indonesiaterserah'];ga bisa belanja baju lebaran offline ga bikin lu matiindonesiaterserah;khairunnisandita;negative;anger
22/05/2020 02:29;['#indonesiaterserah'];jangan sok2an indonesia terserah deh mending kalian itu jaga diri kalian dan keluarga kalian daripada cuman sok ikutan indonesiaterserah;masangga;negative;anger
22/05/2020 02:28;['#indonesiaterserah'];wabah yang berujung pasrah indonesiaterserah pictwittercomyhqkyihwqf;pks riau;negative;sad
22/05/2020 02:23;['#indonesiawhatever', '#indonesiaterserah'];tadi gua gak sengaja liat story whatsapp guru smp dan dia bagiin ini utk kalian yg masih ngeremehin covid19 dan nantangin takdir tuhan plis dirumah aja kalo emang gk penting bgt buat keluar dan patuhi peraturan pemerintah indonesiawhatever indonesiaterserah pictwittercomahyancxinc;ichanloey;negative;anger
22/05/2020 02:18;['#indonesiaterserah'];pemerintah cuma perlu tegas jangan plin plan indonesiaterserah ;wizzi;negative;anger
22/05/2020 02:16;['#indonesiaterserah'];hormat setinggitingginya untuk para medis di indonesia maaf saudaramu banyak yang bersikap bodoamat doa terbaik untuk para medis indonesia indonesiaterserah;san;positive;love
22/05/2020 02:15;['#indonesiaterserah'];ya allahwes dikandani bola bali kok yohnek kepenak italia kae ora akeh si dadi korbanindonesiaterserah;follow back;negative;sad
22/05/2020 02:13;['#indonesiaterserah'];sampai pandemi corona pun sempatsempatnya dibuat prank indonesiaterserah;pnnw ;negative;anger
22/05/2020 02:13;['#jermberterserah', '#indonesiaterserah'];nek pengin mati yo matio deweojo ngajak wong liyojermberterserahindonesiaterserah ;kusbandono ibarhim;negative;anger
22/05/2020 02:08;['#indonesiaterserah'];rezim jokowimaruf sdh lempar handuk indonesiaterserah rakyat sekarang wis wayahe ;islam4all;negative;anger
22/05/2020 02:08;['#indonesiaterserah'];indonesiaterserah berkerumun di pasar di mall di bandara di pelabuhan boleh tapi berjamaah di masjid tidak bolehnugarislucumuhammadiyingl;bronky van tracal;negative;anger
22/05/2020 02:07;['#indonesiaterserah'];kalian yang sibuk milih baju lebaran di mallpunya perasaan kagapara dokter juga punya keluargamereka juga pengen kaya kalian kumpul dihari lebaran sama keluargaketemu anakbukan cuman loe pada yg mau bahagiakesannya mereka mati2an berjuang sendirianindonesiaterserah;ulvi dewi;negative;anger
22/05/2020 02:07;['#gasidoprei', '#dirumahaja', '#indonesiaterserah'];ada yg masih belum rela gasidoprei dirumahaja indonesiaterserah pictwittercomegpakdznd2;nyoms;negative;sad
22/05/2020 02:05;['#indonesiaterserah'];dear disdukcapil republik indonesia mohon berikan data yang diperlukan kepada petugas bansos pandemi covid19 karena yang berdampak oleh pandemi ini adalah seluruh rakyat indonesia tanpa terkecualiindonesiaterserahmustika agung jaya;mustika agung jaya;negative;sad
22/05/2020 01:57;['#indonesiaterserah', '#imundaniman'];setelah pandemi ini berakhir akankah keadaan kembali normal atau akan tercipta keadaan normal yang baruapakah benar sedikit demi sedikit kita sedang dipaksa membenarkan sesuatu yang sejatinya abnormaluntuk terciptanya keadaan normal yang baruindonesiaterserahimundaniman;izazaaz;negative;fear
22/05/2020 01:55;['#indonesiaterserah'];mana yang lebih kuat kuasanya agama atau seleksi alamindonesiaterserah pictwittercomkcnqecndy3;ngeringerisedap;negative;sad
22/05/2020 01:52;['#indonesiaterserah'];udah ambyar ndak dapat pemasukkan hingga tiga bulan ini udah ganti profesi buat bertahan hidup masih lamakah pandemi ini udah bosen stay at home indonesiaterserah;wong cilik ngapakraya;negative;sad
22/05/2020 01:51;['#indonesiaterserah', '#covid?19', '#jepang'];tapi jepang masih lebih baik sih timbang indonesia dalam menangani coronaindonesiaterserahcovid19jepang pictwittercoml1gqttpqvm;  slowresp;negative;sad
22/05/2020 01:47;['#indonesiaterserah'];saat poltik tak tau mana yang tajam atau yang tumpulindonesiaterserah pictwittercompcohugux0l;lialiarbain;negative;anger
22/05/2020 01:45;['#indonesiaterserah'];saat sakit yang obati dan rawat siapa omg indonesiaterserah;bhendratmo;negative;anger
22/05/2020 01:45;['#indonesiaterserahsukasukakalian', '#indonesiaterserah', '#semangattimmedis'];sudah muak dengan isi berita isi nya masalah dan masalahada apa dengan mu wahai rakyat bekerja keraslah sama ingin bebas indonesiaterserahsukasukakalian indonesiaterserah semangattimmedis;apriyani19;negative;anger
22/05/2020 01:45;['#indonesiaterserah'];gak bar2 gak ambyarindonesiaterserah;fakhri is back;negative;anger
22/05/2020 01:39;['#ehh', '#indonesiaterserah'];duluusmpt ngefans ama mbak inihhhtp sejakahsudahlahduh mbaknya kena prank jg inihehh kena apa bagian dari yaterserah dehhh toh indonesiaterserah ga pemerintah ga rakyatbyk yg ndablegg karepmuuuu wess ;   ;negative;sad
22/05/2020 01:38;['#indonesiaterserah'];kemarin hampir tembus 1000 orang positif covid19 dalam sehariindonesiaterserah pictwittercom1tlc4hdze6;chacasalong;negative;fear
22/05/2020 01:38;['#indonesiaterserah'];pemandangan pagi ini saat aku terbangun kok berisik sekali diluar eh ternyata wow sepertinya warga tidak sabar untuk masak ketupat dan apa itu psbb bukan sesuatu yg mendesak lebih mendesak untuk makan ketupat dihari rayalokasi pasar kebon melati0620 amindonesiaterserah pictwittercomtopf9sauwf;mif;negative;anger
22/05/2020 01:28;['#indonesiaterserah'];tak punya pun tak apa masih ada kantong jenazah indonesiaterserah ;fidz ;negative;sad
22/05/2020 01:26;['#indonesiaterserah'];reposted from dewihamfara kalian sudah kalahindonesiaterserahkalian sudah kalahitu yang dikatakan firaun ketika nabi musa as sampai di tepi laut merah tak ada jalan lagikalian sudah kalahitu yang ;imahdaisychamomile;negative;
22/05/2020 01:26;['#indonesiaterserah'];politisi pdip tagar indonesiaterserah itu jerit suara masyarakat yang wajib didengar ;radaraktual;negative;sad
22/05/2020 01:25;['#indonesiaterserah'];witwaktu indonesia terserah indonesiaterserah;el ghiefari;negative;anger
22/05/2020 01:22;['#indonesiaterserah'];salut aja buat orang yang gak takut sama corona katanya kematian ada di tangan tuhansini kumpulin orgny kalo penyakit kamu cari bakalan dateng mas broibartkn kita beli baju lebaran terus yang jualan kena corona lo pakesekeluarga lo mati kena corona mampus indonesiaterserah;boboboifakboi;negative;anger
22/05/2020 01:19;['#indonesiaterserah'];indonesiaterserah benar2 diterapkan kalau saja ketegasan aturan diterapkan pastinya ini tidak terjadi gugustugaswsb pakjk nadirs cnnindonesia ;machmud;negative;sad
22/05/2020 01:16;['#indonesiaterserah'];indonesiaterserah pagi2 ada info rapid test gratis di giant depok liat komen warganya bukan pada seneng malah pada ngehujat pictwittercomajydszsesb;a g u n g;negative;sad
22/05/2020 01:08;['#indonesiaterserah', '#indonesiabangkitbersama'];daripada indonesiaterserah lebih baik indonesiabangkitbersamadapat salam dan ucapan idul fitri 1441 dari anak2 tk alfattaah purwokertoindonesia bangkit kita bisa bersama biar orang lain terserah dan tak ;sapto nugroho hadi;positive;
22/05/2020 01:07;['#mnuh', '#indonesiaterserah', '#indonesiaterserahsukasukakalian']; seharusnya dijadikan contoh konser new normal di indonesiamnuh indonesiaterserah indonesiaterserahsukasukakalian;subandi saputra stronghold;negative;anger
22/05/2020 01:07;['#indonesiaterserah'];astagfirullah otaknya ngga pada dipake nih indonesiaterserah;agung;negative;anger
22/05/2020 01:03;['#indonesiaterserah'];msh fluktuatif sih sy pikir jgn happy dulu indonesiaterserah;agung;negative;fear
22/05/2020 01:02;['#covid?19', '#indonesiamelawancovid19', '#indonesiaterserah'];data 23 jt orang bocor ini kayanya kalau ada niknya terus d hubungin sama apps n provider sim card yang bs bantu tracing covid19 bisa lbh bantu indonesiamelawancovid19 kali ya cuman beride di pagi hari colek bu siti fadilah indonesiaterserah blogdokter drsyukinfokes ;dokter pribadi podcast;negative;
22/05/2020 01:01;['#indonesiaterserah'];klo rakyat nya pd waras ya hrsnya bgini tdk spt yg terjadi di negeri dongeng sebelah indonesiaterserah;agung;negative;anger
22/05/2020 00:59;['#indonesiaterserah'];nahh bakal lbh seru nih kynya indonesiaterserah;agung;negative;
22/05/2020 00:58;['#indonesiaterserah'];politisi pdip tagar indonesiaterserah itu jerit suara masyarakat yang wajibdidengar ;radaraktualdotcom;negative;anger
22/05/2020 00:58;['#indonesiaterserah'];mgkn mrk dinas di kampung halaman indonesiaterserah;agung;negative;anger
22/05/2020 00:57;['#indonesiaterserah'];apa ini krn mau lebaran jd bpk minta maaf slm ini apa yg bpk sdh lakukan indonesiaterserah;agung;negative;anger
22/05/2020 00:54;['#stayathome', '#indonesiaterserah'];thx god puasa dan ied fitri kali ini tak seperti suasana puasa dan ied fitri tahun kemarin stayathomeindonesiaterserah;hai hai hallo;negative;sad
22/05/2020 00:52;['#indonesiaterserah'];bener bener dah depoksekalinya berita positif malah positif corona terbanyak di jabarindonesiaterserah ;pemuja bleki;negative;fear
22/05/2020 00:51;['#mudiktetapdilarang', '#psbb', '#indonesiasakkarepmu', '#indonesiaterserah']; dokter gelepakan rakyat kelaparan para menteri buka bandara rakyat goblok belanja ke mall dilarang mudik tetapi ada syaratmiris sekali keadaan bangsa inimudiktetapdilarang psbb indonesiasakkarepmu indonesiaterserah;bisa gitu yaa;negative;anger
22/05/2020 00:49;['#indonesiaterserah'];opo meh kiamat ndisik yo endonesa i rakyate kok ngasu kabeh indonesiaterserah;y gede;negative;sad
22/05/2020 00:48;['#indonesiaterserah'];dalam negara kapitalis keselamatan ekonomi jauh lebih diutamakan daripada keselamatan rakyatnya itulah alasan mengapa tempat perekonomian di negara ini telah dibukaini membuktikan bahwa harta dinegara ini jauh lebih dihargai daripada nyawa seseorang indonesiaterserah;suami dakjall;negative;sad
22/05/2020 00:48;['#indonesiaterserah'];losssss semoga segera psbb dijalan jalan nganjuk prima swalayan cafe cafe kan masih lossss rame indonesiaterserah;anak buah gusdur  abg ;negative;anger
22/05/2020 00:47;['#dirumahaja', '#fyp', '#indonesiaterserah', '#paramedis', '#foryou'];yg begini engga di tendangin dan enggak di nyinyiran oleh penghuni kolam please dirumahaja hargai mereka yg di garda terdepan fyp indonesiaterserah paramedis foryou pictwittercomsy1boo7x4e;muzdhalifah;negative;anger
22/05/2020 00:46;['#indonesiaterserah'];gangerti lagi gua sehari nambah 973 orang percuma diberitain kabar baik kalo orang orangnya masih pada bego egois dan ngeyelan indonesiaterserah pictwittercomuxnivxhtyo;ferdinand;negative;anger
22/05/2020 00:43;['#indonesiaterserah'];auu ahhh indonesiaterserah ;gobar;negative;anger
22/05/2020 00:41;['#indonesiaterserah', '#psbb'];sebenarnya di atas sana ada apaan sih indonesiaterserah psbb;bisa gitu yaa;negative;anger
22/05/2020 00:41;['#indonesiaterserah'];di zaman rasullullah saat munculnya wabah rasulluah dan para mengikutnya tidak berani keluar dan memilih beribadah di kediamannya masingmasing sedang kita yang cuma manusia biasa memilih sok kebal melawan terhadap wabah indonesiaterserah pictwittercomzhumt67tdo;rizky faza ramadhan;negative;anger
22/05/2020 00:41;['#indonesiaterserah'];siklus covid di indonesia kayak perjuangin kamu ditanya mau makan apa jawabnya terserah didiemin pas marahan dikatain ga peka ga didiemin dibilang ini salah lu ga usah bacot deh negeri ini perumpamaan wanita indah tapi rumitindonesiaterserah pictwittercomzhjbog5oqq;r a n;negative;anger
